{
  "clearance_decision": "PROCEED_TO_KYC",
  "clearance_timestamp": "2026-08-18T14:24:15Z",
  "institution_id": "sunrise_digital_bank_afsp_001",
  "institution_signature": "MEQCIDATf4xRokkFLUgjBdpc2CUCVVZAGuHOdEBX69KxKKhaAiA9/LTk2/AQwXd6U/Ve4RokNMe/s90J9elVy7/QOIUf8w==",
  "package_id": "pkg_1a3c5e7f9b2d4f6a8c0e2b4d6f8a0c2e4b6d8f0a1c3e5a7c9e1b3d5f7a9c1e3b"
}
